{
  "schemaVersion": "proposal.v1",
  "artifact": {
    "contractId": "job-application-email-facts.v1",
    "digest": "95db8498651e03d434755c2a3c97e73be389448159dc445ee0f6e204fd458da5"
  },
  "trust": "model_proposal",
  "requiresHumanReview": true,
  "automatic": false,
  "sideEffect": "none",
  "usage": {
    "schemaVersion": "usage-receipt.v1",
    "trust": "provider_reported",
    "observedInputTokens": 1200,
    "observedOutputTokens": 340,
    "chargedTokens": 1540,
    "observedCostMicroUsd": 4200,
    "chargedCostMicroUsd": 4200,
    "durationMs": 5300,
    "routeAlias": "frontier-default"
  },
  "payload": {
    "schemaVersion": "job-application-email-facts.v1",
    "trust": "untrusted_external",
    "source": {
      "provider": "gmail",
      "accountId": "jobs@example.test",
      "messageId": "message-1",
      "threadId": "thread-1",
      "receivedAt": "2026-07-18T02:00:00.000Z",
      "fromAddress": "recruiter@example.test",
      "fromDomain": "example.test",
      "contentDigest": "aaaaaaaaaaaaaaaaaaaaaaaaaaaaaaaaaaaaaaaaaaaaaaaaaaaaaaaaaaaaaaaa"
    },
    "contentCompleteness": "sanitized_plain_text",
    "eventKind": "action_required",
    "postingRefs": [],
    "applicationRefs": [],
    "replyRequested": false,
    "evidence": [
      {
        "field": "from",
        "excerpt": "recruiter@example.test"
      },
      {
        "field": "subject",
        "excerpt": "Application communication"
      }
    ],
    "extraction": {
      "provider": "inbox-pipeline",
      "version": "jobtrack-relay.v2",
      "confidence": 0.87
    },
    "security": {
      "risk": "medium",
      "requiresReview": true
    }
  }
}
